{
  "contractVersion": 1,
  "generatedAt": "2026-10-16T05:00:00.000Z",
  "status": {
    "state": "ok",
    "refreshing": false,
    "message": null,
    "lastSuccessAt": "2026-10-16T05:00:00.000Z",
    "nextRefreshAt": "2026-10-16T05:00:45.000Z",
    "paused": false,
    "pausedReason": null
  },
  "me": {
    "id": "m-1",
    "name": "김민준"
  },
  "dooray": {
    "domain": "example.dooray.com",
    "webUrl": "https://example.dooray.com"
  },
  "rules": {
    "dueSoonDays": 3,
    "recentDays": 7,
    "taskListLimit": 10
  },
  "summary": {
    "projectCount": 6,
    "counts": {
      "open": 44,
      "backlog": 10,
      "registered": 14,
      "working": 20,
      "overdue": 10,
      "dueSoon": 9,
      "mine": 11,
      "unassigned": 5,
      "closedRecently": 20
    }
  },
  "projects": [
    {
      "id": "p-1",
      "name": "모바일앱-리뉴얼",
      "description": "고객용 모바일 앱 2.0 개편",
      "url": "https://example.dooray.com/project/projects/p-1",
      "counts": {
        "open": 14,
        "backlog": 2,
        "registered": 3,
        "working": 9,
        "overdue": 3,
        "dueSoon": 2,
        "mine": 4,
        "unassigned": 1,
        "closedRecently": 6
      },
      "workflows": [
        {
          "id": "wf-b",
          "name": "대기",
          "class": "backlog",
          "count": 2
        },
        {
          "id": "wf-r",
          "name": "접수",
          "class": "registered",
          "count": 3
        },
        {
          "id": "wf-w",
          "name": "처리중",
          "class": "working",
          "count": 5
        },
        {
          "id": "wf-v",
          "name": "검토중",
          "class": "working",
          "count": 4
        }
      ],
      "assignees": [
        {
          "id": "m-2",
          "name": "이서연",
          "open": 7,
          "working": 5,
          "overdue": 2,
          "isMe": false
        },
        {
          "id": "m-1",
          "name": "김민준",
          "open": 4,
          "working": 3,
          "overdue": 1,
          "isMe": true
        },
        {
          "id": "m-4",
          "name": "최유나",
          "open": 2,
          "working": 0,
          "overdue": 1,
          "isMe": false
        },
        {
          "id": "m-5",
          "name": "정하준",
          "open": 1,
          "working": 1,
          "overdue": 0,
          "isMe": false
        }
      ],
      "tasks": {
        "open": [
          {
            "id": "p-1-t11",
            "key": "모바일앱-리뉴얼/110",
            "number": 110,
            "subject": "접근 로그 보관 기간 확인",
            "url": "https://example.dooray.com/project/tasks/p-1-t11",
            "projectId": "p-1",
            "projectName": "모바일앱-리뉴얼",
            "workflowClass": "backlog",
            "workflowName": "대기",
            "priority": "none",
            "dueDate": "2026-10-14T15:00:00.000Z",
            "deadline": "2026-10-15T15:00:00.000Z",
            "dueState": "overdue",
            "assignees": [
              {
                "id": "m-2",
                "name": "이서연"
              }
            ],
            "author": {
              "id": "m-1",
              "name": "김민준"
            },
            "isMine": false,
            "createdAt": "2026-10-12T15:24:21.353Z",
            "updatedAt": "2026-10-15T15:24:21.353Z",
            "tags": [
              {
                "id": "tag-c2",
                "name": "고객사: 예시군청",
                "color": "#ECF7FF",
                "group": "고객사"
              },
              {
                "id": "tag-p2",
                "name": "제품: 전자결재",
                "color": "#FFF2EB",
                "group": "제품"
              }
            ],
            "categoryIds": [],
            "stale": false
          },
          {
            "id": "p-1-t8",
            "key": "모바일앱-리뉴얼/107",
            "number": 107,
            "subject": "데이터 백업 주기 검토",
            "url": "https://example.dooray.com/project/tasks/p-1-t8",
            "projectId": "p-1",
            "projectName": "모바일앱-리뉴얼",
            "workflowClass": "working",
            "workflowName": "검토중",
            "priority": "none",
            "dueDate": "2026-10-17T15:00:00.000Z",
            "deadline": "2026-10-18T15:00:00.000Z",
            "dueState": "soon",
            "assignees": [
              {
                "id": "m-2",
                "name": "이서연"
              }
            ],
            "author": {
              "id": "m-3",
              "name": "박지호"
            },
            "isMine": false,
            "createdAt": "2026-10-12T12:12:43.974Z",
            "updatedAt": "2026-10-15T12:12:43.974Z",
            "tags": [],
            "categoryIds": [],
            "stale": false
          },
          {
            "id": "p-1-t14",
            "key": "모바일앱-리뉴얼/113",
            "number": 113,
            "subject": "DB 인덱스 재구성",
            "url": "https://example.dooray.com/project/tasks/p-1-t14",
            "projectId": "p-1",
            "projectName": "모바일앱-리뉴얼",
            "workflowClass": "registered",
            "workflowName": "접수",
            "priority": "none",
            "dueDate": "2026-10-12T15:00:00.000Z",
            "deadline": "2026-10-13T15:00:00.000Z",
            "dueState": "overdue",
            "assignees": [
              {
                "id": "m-2",
                "name": "이서연"
              },
              {
                "id": "m-4",
                "name": "최유나"
              }
            ],
            "author": {
              "id": "m-5",
              "name": "정하준"
            },
            "isMine": false,
            "createdAt": "2026-10-11T23:25:39.345Z",
            "updatedAt": "2026-10-14T23:25:39.345Z",
            "tags": [
              {
                "id": "tag-c3",
                "name": "고객사: 예시재단",
                "color": "#ECF7FF",
                "group": "고객사"
              }
            ],
            "categoryIds": [],
            "stale": false
          },
          {
            "id": "p-1-t13",
            "key": "모바일앱-리뉴얼/112",
            "number": 112,
            "subject": "운영 서버 인증서 갱신",
            "url": "https://example.dooray.com/project/tasks/p-1-t13",
            "projectId": "p-1",
            "projectName": "모바일앱-리뉴얼",
            "workflowClass": "working",
            "workflowName": "처리중",
            "priority": "low",
            "dueDate": null,
            "deadline": null,
            "dueState": "none",
            "assignees": [
              {
                "id": "m-2",
                "name": "이서연"
              }
            ],
            "author": {
              "id": "m-1",
              "name": "김민준"
            },
            "isMine": false,
            "createdAt": "2026-10-10T12:41:20.754Z",
            "updatedAt": "2026-10-13T12:41:20.754Z",
            "tags": [
              {
                "id": "tag-c3",
                "name": "고객사: 예시재단",
                "color": "#ECF7FF",
                "group": "고객사"
              }
            ],
            "categoryIds": [],
            "stale": false
          },
          {
            "id": "p-1-t10",
            "key": "모바일앱-리뉴얼/109",
            "number": 109,
            "subject": "결제 모듈 테스트 케이스 보완",
            "url": "https://example.dooray.com/project/tasks/p-1-t10",
            "projectId": "p-1",
            "projectName": "모바일앱-리뉴얼",
            "workflowClass": "working",
            "workflowName": "처리중",
            "priority": "high",
            "dueDate": null,
            "deadline": null,
            "dueState": "none",
            "assignees": [
              {
                "id": "m-2",
                "name": "이서연"
              }
            ],
            "author": {
              "id": "m-4",
              "name": "최유나"
            },
            "isMine": false,
            "createdAt": "2026-10-09T03:01:23.914Z",
            "updatedAt": "2026-10-12T03:01:23.914Z",
            "tags": [
              {
                "id": "tag-c2",
                "name": "고객사: 예시군청",
                "color": "#ECF7FF",
                "group": "고객사"
              }
            ],
            "categoryIds": [],
            "stale": false
          },
          {
            "id": "p-1-t3",
            "key": "모바일앱-리뉴얼/102",
            "number": 102,
            "subject": "API 응답 속도 개선",
            "url": "https://example.dooray.com/project/tasks/p-1-t3",
            "projectId": "p-1",
            "projectName": "모바일앱-리뉴얼",
            "workflowClass": "working",
            "workflowName": "검토중",
            "priority": "high",
            "dueDate": null,
            "deadline": null,
            "dueState": "none",
            "assignees": [
              {
                "id": "m-2",
                "name": "이서연"
              }
            ],
            "author": {
              "id": "m-4",
              "name": "최유나"
            },
            "isMine": false,
            "createdAt": "2026-10-08T12:23:21.733Z",
            "updatedAt": "2026-10-11T12:23:21.733Z",
            "tags": [
              {
                "id": "tag-c3",
                "name": "고객사: 예시재단",
                "color": "#ECF7FF",
                "group": "고객사"
              }
            ],
            "categoryIds": [],
            "stale": false
          },
          {
            "id": "p-1-t4",
            "key": "모바일앱-리뉴얼/103",
            "number": 103,
            "subject": "관리자 권한 정책 정리",
            "url": "https://example.dooray.com/project/tasks/p-1-t4",
            "projectId": "p-1",
            "projectName": "모바일앱-리뉴얼",
            "workflowClass": "working",
            "workflowName": "처리중",
            "priority": "none",
            "dueDate": null,
            "deadline": null,
            "dueState": "none",
            "assignees": [
              {
                "id": "m-1",
                "name": "김민준"
              }
            ],
            "author": {